,URL,Conteúdo
0,https://www.estadao.com.br/paladar/balcao-do-giba/loop-abre-as-portas-na-vila-madalena-com-foco-na-sustentabilidade/,"Olá, amigos! Todos bem?O mundo da coquetelaria em São Paulo está agitado.Logo, teremos mais uma edição doBCB (Bar Convent)- maior evento de bares e coquetelaria do mundo (que esse ano acontece no Pavilhão da Bienal, dias 5 e 6 de junho).No próprio BCB, vamos acompanhar a final doWorld Class Brasil. Aliás, a final mundial também vai acontecer em São Paulo, em setembro.Por conta do evento, muitos nomes da coquetelaria mundial estão desembarcando no País.O BCB vai contar com a presença de Simon Ford, uma lenda atrás do bar e no mundo dos destilados, além de um dos criadores da bebida (Fords Gin).newsletterPaladarAs melhores críticas gastronômicas, receitas e dicas de bares e restaurantes, às sextas-feiras.inscreverAo se cadastrar nas newsletters, você concorda com osTermos de UsoePolítica de Privacidade.Com tanta coisa acontecendo, muitos nomes da coquetelaria mundial estão desembarcando no País.Continua após a publicidadeGustavo Vocke, embaixador da Jack Daniel’s na América Latina e dono do bar Tres Monos, considerado um dos 50 melhores bares do mundo, estará no dia 5 de junho no Guilhotina para um guest com Spencer Amereno Jr., Head bartender da casa.Dois dias depois, o Tan Tan será palco de um intercâmbio especial de bartenders no dia 7 de junho. Em um evento especial, o chef Thiago Bañares e o headbartender Caio Carvalhaes recebem representantes dos premiados bares HandShake Speakeasy, da Cidade do México, e The Cambridge Public House, de Paris.No dia 7 também rola a final do Campari Competition, no Labof, na Vila Mariana.Quase não da pra respirar, né.O balcão do novo Loop BarFoto:  Gabriel CabralMas vamos com calma... porque além de tudo ainda temos inauguração de bar na cidade, mais especificamente na Rua Purpurina, na Vila Madalena.Em um casarão no número 272 da Purpurina acaba de abrir (em soft opening) o Loop - bar que pretende se conectar com a tendência mundial de uma coquetelaria mais sustentável.Continua após a publicidadeCarlos Franco, um dos sócios e encarregados do bar, já passou pelo Guilhotina, Utopia e IscondidoEle e a mulher, Viviane Veisid — também sócia do empreendimento —, passaram sete meses na Europa (França, Alemanha, Espanha e POrtugal) atrás de cursos e referências em coquetelaria.Viviane Veisid e Carlos FrancoFoto:  Gabriel CabralDe volta ao Brasil em julho de 2022, o casal decidiu abrir um bar tendo como sócio e investidor o irmão de Viviane, o músico e produtor musical Alexandre Stuhlberger.Na carta, Carlos apresenta cinco drinques clássicos reimaginados e nove autorais. Exemplos são as releituras da caipirinha, feita com blend de cachaça, cordial de cana e granita de limão, e do dirty martini, que leva infusão de azeitonas sicilianas, vermute dry, caviar do azeitonas e limão siciliano.Entre os coquetéis criados por Carlos está o Mare Nostrum, composto por um blanco (rum não envelhecido), yuzu, água de coco, cordial de Champagne e ar salino.Todos os coquetéis custam R$ 42.Continua após a publicidadeLoop bar abre na Vila MadalenaFoto:  Gabriel CabralNA MODAA Love Delivery, antiga Surreal SP, criou uma coleção cápsula inédita para celebrar as conexões unindo uísuqe, moda e música. Intitulada “Better With Friends”, a collab é uma parceria de dois sócios da marca, que também são integrantes da banda Terno Rei, com Jameson Irish Whiskey.Já disponível para o público no site da Love, a coleção conta com 12 peças desenvolvidas com a alta qualidade e modelagem exclusiva da LD.APTK ExperienceA APTK Experience é uma sessão interativa de 90 minutos para até 8 pessoas comandadas por bartenders Fatinha Afonso e Marcelo Serrano. Nos encontros serão abordadas noções básicas de coquetelaria. Os participantes irão aprender a preparar 3 coqueteis clássicos.São dois temas: Martini Experience (com a Fatinha Afonso) e o Vodka Experience (com Marcelo Serrano). Cada sessão custa R$ 250. Os encontros acontecem duas vezes por mês, sempre às 19h, nas  lojas APTK no Shops Jardins e no Shopping Cidade Jardim."
1,https://www.estadao.com.br/paladar/balcao-do-giba/com-fiica-bartender-toalha-realiza-o-sonho-da-casa-propria/,"Olá,amigos!Todos bem?O balcão de hoje vai apresentar o Fiíca - bar que abre oficialmente no próximo dia 29.O Fiíca ""fica"" (ops) em um endereço conhecido dos aficionados em coquetelaria - no lugar em que antes ficava o Espaço 13, na Rua 13 de Maio.newsletterPaladarAs melhores críticas gastronômicas, receitas e dicas de bares e restaurantes, às sextas-feiras.inscreverAo se cadastrar nas newsletters, você concorda com osTermos de UsoePolítica de Privacidade.Continua após a publicidadeO bar é a ""casa própria"" do bartenderThiago Toalha, em sociedade com Victoria Tenerelli e Cinthia Nunes.Tiago Toalha agora também é dono de bar. Crédito: Tiago QueirozToalha consolidou sua reputação no mundo dos bares como chefe bar da rede Lê Jazz, onde lançou a página de crônicas da vida de bartender (@barmandepre). Ele passou pelo speakeasy Flora Bar e também atuou como embaixador da destilaria San Basile.O nome do bar, Fiíca, é uma homenagem à dona Auda Cassimiro,  bisavó da sócia Victoria Tenerelli. Fiíca era o apelido de Auda - e seria um derivado de filhinha. Dona Auda era do tipo que recebia visitas com a mesa sempre farta, uma boa cachaça e com muita conversa. No material de divulgação da casa, uma boa explicação:  ""Fiíca nos desperta o que é uma hospitalidade ingênua, natural, afetiva e acolhedora"".Continua após a publicidadePara a casa, Toalha preparou uma carta com 13 coquetéis autorais e releituras e 13 coquetéis clássicos.Entre as novidades do Toalha está o Highball de Galo:(Receita)45ml cachaça em amburana20ml Artichoke 20ml Vermute tinto Bitter de laranja e Ginger Ale Finalizando com casca de laranja e azeitonaContinua após a publicidadeHighball de Galo. Foto. MarinhoE também o 10 pras 4(Receita)40ml café expresso 30ml licor bizantino 5ml Fernet Finalizado com óleos essenciais de casca de laranja.O Fiíca está na Rua Treze de Maio, 798 - Bixiga - SP.Continua após a publicidade10 pras 4.Foto:  MarinhoALERTA DE CARTAS NOVASBar dos ArcosOBardosArcos, localizado no no subsolodoTheatro Municipal, homenageia históriasdemulheres que fizeram e fazem sua voz ecoar em sua nova cartadedrinques, que contam com receitas que carregam, em seus títulos, referências como: 'A mulherdofimdomundo' (Elza Soares), 'O segundo sexo' (SimonedeBeauvoir) e 'A Eleita' (Erika Hilton). A carta foi desenvolvida por Michelly Rossi em conjunto com o seu time Telles Almeida, Maiara Rodrigues, Thiago Farias, Fab Canne, João Salustiano, Carlos Roberto Teles, Luigi Minotto, Gabriela Fernandes, Eduardo Trindade e Marcia Romualdo.Continua após a publicidadeRivieraO Riviera Bar, localizado na esquina da Av Paulista com a Consolação, apresenta sua nova carta de drinques: 'Crônicas de uma bebida anunciada', inspirada na América Latina. A nova carta de coquetéis é uma ode à potência latina, acolhedora e diversa, elaborada por Michelly Rossi, consultora do Fábrica de Bares e o Eduardo Tavares, chefe de bar.AMARGOTO Amargot Bar está com uma carta de drinks dedicada às ""Margots"" que amargaram o mundo, inspirado pelo Dia Internacional da Mulher. Cada Margot ganhou uma receita de drink feito especialmente para a data, que fica até o dia 7 de abril no cardápio -  10% da renda desse menu será revertida a instituições que atendem mulheres no litoral norte de São Paulo.ALERTA DE GUESTContinua após a publicidadeNo dia 29 de março, o Koya88 recebe o bartender Pasczkowski e a gerente Melanie da Conceição, especialista em hospitalidade, do premiado Salmon Guru, direto de Madri, o bar espanhol listado em 2022 como o décimo quinto melhor bar do mundo pelo 50th best.COMEMORAÇÃOSeguem as comemorações pelos 4 anos do Mundi Bar. Na proxima quinta-feira, dia 30, é a vez de Suemi Uemura, consultora de bares, levar a cultura asiática para o Mundi. O Mundi Bar fica na rua Itapicuru, 828.GRAN CIRCUITO DE COQUETÉISA APTK Spirits desafiou 40 bares de São Paulo a criar um coquetel autoral usando um de seus rótulos. Agora, de 31 de março a 04 de junho, amantes da coquetelaria terão a oportunidade de conhecer e degustar o resultado, na segunda edição doGran Circuito de Coquetéis APTK.Neste ano, casas como Guilhotina, Ama.zo Perunao, Iscondido Bar, Preto, Princeless, Torero Valese, Café Hotel, Botanikafe, Bar da Dona Onça, Drosophyla, Gaarden, Me Gusta participam da ação.COLLABO gim Monkey 47, da Pernod Ricard Prestige, e a marca de streetwear*A BATHING APE® (BAPE®) se uniram  para criar uma colaboração exclusiva que acaba de chegar ao Brasil. Composta por cinco peças - moletom, camiseta, camisa havaiana, skate e uma edição limitada do Monkey 47 Schwarzwald Dry GIN - a coleção cápsulacombina a excêntrica estampa de selva de Monkey 47 ao famoso visual de camuflagem da BAPE®. Para os fãs, as peças estarão à venda na loja Guadalupe  e a garrafa comemorativa Monkey 47 Schwarzwald Dry GIN poderá ser encontrada no site Bar Aberto."
2,https://www.estadao.com.br/paladar/balcao-do-giba/nao-sabe-o-que-dar-de-presente-no-dia-das-maes-que-tal-preparar-um-coquetel-para-a-mulher-mais-importante-da-sua-vida/,"Olá, amigos!Todos bem?Leia tambémMelhores vinhos a partir de R$ 67,80 para presentearODia das Mãesestá chegando e tem muita gente (eu incluso) que ainda não sabe o que dar de presente.O Balcão de hoje vem trazer uma luz - e com uma semana de antecedência para você, caro leitor(a), ter tempo de se aprimorar na reprodução destes presentes.Sim, óbvio, estou sugerindo que você faça um coquetel em homenagem à sua mãe.Por isso, contei com a colaboração de três ótimos bartenders aqui de São Paulo:Thiago Toalha(Fiica Bar),Chris Carijó(Preto Cozinha) eRodrigo Roso(Infini Bar).newsletterPaladarAs melhores críticas gastronômicas, receitas e dicas de bares e restaurantes, às sextas-feiras.inscreverAo se cadastrar nas newsletters, você concorda com osTermos de UsoePolítica de Privacidade.Segue o fio:Continua após a publicidadeThiago Toalha apresentou o Alkermes Sour:Coquetel do Toalho para o Dia das mães. Crédito: Tales Hidequi""Se eu for servir um coquetel para a minha mãe, no dia dela, tem que ser algo marcante, prazeroso e que emocione. Afinal, servir um cocktail para minha mãe, de fato já é algo extremamente emocionante. E hoje eu só consigo pensar em um dos coquetéis que mais me emociono ao fazer ou tomar. Algo que é simples e complexo ao mesmo tempo"", disse Toalha.ALKERMES SOURAlkermes* - 30mlVermute tinto - 20mlSuco de limão siciliano - 20mlContinua após a publicidadeXarope de açúcar - 10mlClara de ovo (opcional) para trazer mais textura e beleza ao coquetel.Acrescentar todos os ingredientes numa coqueteleira, bater por aproximadamente 7 segundos, fazer uma coagem dupla em um copo baixo previamente gelado. Finalizar com uma fatia de laranja.""Alkermes é amplamente utilizado nas sobremesas e sempre dá um toque especial nos doces, como o tiramisú, a torta mimosa e variações do panetone. Minha mãe merece o melhor!"", explicou Toalha.Vamos ao coquetel do Carijó para esse Dia das Mães. Trata-se do Goiabinha Sour. E ele vai:Goiabinha Sour60 ml cachaça envelhecidaContinua após a publicidade30 ml limão siciliano30 ml clara de ovo2 bailarinas de goiabadaBater tudo com bastante gelo em uma coqueteleira e servir em uma taça bem gelada.Drinque do Carijó para o Dia das Mães. Crédito Lais AcsaAgora, vamos aumentar um pouco a dificuldade do presente.Para quem já tem alguma prática com coquetelaria e gastronomia e quer, principalmente, impressionar a mamãe, o drinque do Rodrigo Roso é perfeito. Vamos tentar fazer o Mama Duck? Me segue aqui:Continua após a publicidadeMama Duck50ml vodca com 'Fat Wash' de gordura de pato20ml de sumo de limão15ml licor de damasco15ml xarope simples1 dash de solução salinaMisturar tudo em uma coqueteleira, adicionar gelo e bater. Dupla Coagem em uma taça previamente gelada.Continua após a publicidadeO fat wash é uma técnica de maceração de gorduras vegetais ou animais em um destilado.Para essa receita, o Roso utilizou partes iguais de vodca e gordura de pato, deixou dois dias descansando em temperatura ambiente e depois mais 24h na geladeira. A gordura vai se solidificar na parte de cima do recipiente. Agora é só fazer um furo na gordura congelada e coar o líquido com um filtro de café de papel.O coquetel do Roso. Arquivo PessoalOk, você não está no clima de preparar coquetéis. Então, a dica seria levar sua mãe para um bar. Minha sugestão é o Caledônia - que está comemorando o Dia das Mães.O Caledonia vai homenagear uma mãe que integra a equipe do bar. Luana Campos começou sua trajetória na casa atendendo no salão, mas descobriu sua vocação atrás do balcão. Ela virou bartender e, em pouco tempo, conquistou lugar como finalista do Licor 43 Bartenders & Baristas Challenge de 2022. Também participou do concurso do jerez Tio Pepe. Tudo isso, entre duas maternidades. Luana é mãe de um menino de dois anos, que nasceu durante seu primeiro ano no Caledonia, e acaba de dar à luz a uma menina.Luana inspirou a comemoração do Dia das Mães no bar dos sócios Mauricio Porto e Guilherme Valle. Até o sábado, dia 13, estarão em cartaz dois coquetéis criados por ela: oLa Chica(que leva dois tipos de jerez: Tio Pepe fino e Alfonso Oloroso, além de uísque defumado, vermute doce e bitters de laranja) e oLua Nova(que leva Licor 43, Amaro Lucano, limão siciliano, café espresso, angostura aromatic bitters e bitters de laranja. O Caledônia fica na Rua Vapabussu, 309.Homenagem neste Dia das Mães. Crédito: Mauricio PortoContinua após a publicidadeLançamentoA Campari lança o novo design de sua garrafa. Para marcar a ocasião, um inédito show de drones iluminou o céu de Milão com o inconfundível vermelho da Campari, nas noites de 4 e 5 de maio. A nova versão, que será comercializada no Brasil a partir de 2024, é uma homenagem visual à cidade.Leia também: dicas de presentes para mães que amam cozinhar"
3,https://www.estadao.com.br/paladar/balcao-do-giba/drinque-em-homenagem-ao-gabriel-garcia-marquez-no-bar-riviera/,"Olá,amigos!Todos bem?O Balcão de hoje faz uma visita aoBar Riviera- que acaba de lançar uma nova carta de coquetéis. Nesta edição também visitamos dois restaurantes, de dois jovens chefs, que estão investindo em uma coquetelaria com características brasileiras.Então, me segue aqui que a 'ronda' vai ser longa e interessante.Primeira parada, Riviera.newsletterPaladarAs melhores críticas gastronômicas, receitas e dicas de bares e restaurantes, às sextas-feiras.inscreverAo se cadastrar nas newsletters, você concorda com osTermos de UsoePolítica de Privacidade.Continua após a publicidadeEntrada do Riviera Bar.Foto:  Daniel TeixeiraORivieraBarapresentou sua nova carta de drinks 'Crônicas de uma bebida anunciada', inspirada em personagens da  América Latina - e elaborada por Michelly Rossi, consultora do Fábrica de Bares e o Eduardo Tavares, chefe debar.Um dos coquetéis é o Gabo - uma homenagem ao escritor colombiano Gabriel García Márquez (também conhecido por Gabo). Trata-se de uma versão do Espresso Martini - com rum com óleo de coco, cold brew, xarope de coco tostado, licor de café e solução salina (lembrando que a Colômbia é reconhecida pela qualidade do seu café).Continua após a publicidadeNovo coquetel do Riviera.Foto:  BronkoOutro coquetel que me chamou bastante atenção foi o levíssimo Úrsula (uma homenagem à Maria Firmina dos Reis, considerada a primeira romancista negra do Brasil -  e que publicou em 1859 o livro Úrsula). O coquetel leva cachaça, horchata, xarope de açúcar, angostura bitters e gelo triturado. Pode até parecer divisivo, mas achei a combinação de cachaça com horchata bastante elegante.Para quem gosta de algo com um pouco mais de pegada alcoólica, minha indicação é o Dolores - com tequila, jerez, licor maraschino, vinagre de tamarindo e bitter de laranja. Trata-se de um drinque para quem é um pouco mais iniciado nos sabores exóticos da coquetelaria. Mas vale o risco.O Riviera fica na a Av Paulista com a Consolação (e funciona 24 horas por dia).Continua após a publicidadeSura, mais uma novidade do Riviera. Foto BronkoCoquetelaria Brasileira: Lupe e VaralNesta semana também conheci dois restaurantes que estão investindo em coquetelaria com uma pegada bem brasileira.Com o chefGabriel de Lucca Piantino, o Lupe deixou de ser um lugar de comida mexicana para focar em brasilidades. No cardápio, maravilhas como uma Empadinha de moela de pato com emulsão bernaise e pó de hibisco e uma Casquinha de Siri (feita na telha aquafaba de repolho e sagui). Na Coquetelaria, que é o nosso assunto por aqui, a carta Fernando Xavier, que prioriza ingredientes nacionais. Entre as opções: Banzeiro, Macunaíma,  Jorge Amado, Rabo de Galo e Caju Amigo.Continua após a publicidadeDrinques nacionais no Lupe.Foto:  Arquivo/LupeO Varal também investe em comida brasileira e afetiva. O chef Hyssa Abrahim apresenta pratos marcantes como uma carne de panela afogada no molho de cerveja, servida com purê de mandioquinha perfumado com trufas mais farofa de pão e agrião.Na coquetelaria, o foco também são as brasilidades - com drinques em que a cachaça é quem brilha com mais intensidade.  Da carta colaborativa,  experimente o Pai d'Égua, feito com cachaça de jambu, maracujá, rapadura e pimenta dedo-de-moça. E também o meu preferido da noite, o Baleia (inspirado no livro Vidas Secas, de Graciliano Ramos ). O coquetel leva cachaça, vermute seco, bitter de laranja e tônica.Continua após a publicidadePai D'Égua no Varal.Foto:  Lais AcsaLupeRua Cunha Gago, 625 - Pinheiros.VaralRua Artur de Azevedo, 636 - Pinheiros.Continua após a publicidadePS: Esse Balcão tira uma semana de folga por motivos de continuação de férias. Volto daqui duas semanas. beijo."
4,https://www.estadao.com.br/paladar/balcao-do-giba/conheca-os-bares-de-coquetelaria-que-promovem-bailinhos-de-carnaval/,"E chegou o carnaval, amigos!Hoje vamos falar de dois bares de coquetelaria que estarão abertos para 'bailinhos carnavalescos', oDrosophyla Bar eTelefone Speakeasy.Esse balcão gosta e não é pouca de uma folia.Então vamos lá.Bar Drô tem baile de carnavalFoto:  Bruno PolettinewsletterPaladarAs melhores críticas gastronômicas, receitas e dicas de bares e restaurantes, às sextas-feiras.inscreverAo se cadastrar nas newsletters, você concorda com osTermos de UsoePolítica de Privacidade.Pra quem é do Allah-la-ô, ô-ô-ô, ô-ô-ô, o Drô vem com a 6ª edição do CarnaBall. Tratam -se de bailinhos de Carnaval ‘vintage’, com trilha sonora repleta de marchinhas antigas, comoChiquita Bacana, Cidade Maravilhosa, Índio quer Apito, Cabeleira, Bandeira Branca. Nos bailes de sexta e sábado, a equipe do bar estará atenta para avaliar a melhor fantasia, que será presenteada com uma garrafa do Gin Jardim Botânico.Os ingressos: de R$ 45 a R$90. Quando estiver por lá, não deixe de tomar um coquetel da casa. O bar é bemmm interessantes.Continua após a publicidadeJá o Telefone Speakeasy apresenta o Carnaval Vintage, programação especial que acontece até o dia 21 de fevereiro.O bar propõe uma viagem no tempo através dos itens de decoração que passam dos anos 30 a 2000. A pista de dança ganha vida ao som do DJ Leandro Trigo, que toca um mix de brasilidades e clássicos do carnaval. E para incentivar os foliões a entrarem no clima, quem estiver fantasiado ficará isento de consuma mínima. O Telefone oferece um cardápio completo de drinques com toques carnavalescos, como o Oh Là Là (sur l'orange aptk, amaretto, limão, cupuaçu e tônica Limão).Trenzinho de foliões no baile do Drô.Foto:  Bruno PolettiTem clima de carnaval tambémNo G&T Gin Bar o clima também é de carnaval. A casa que está com ambiente repaginado apresenta opções exclusivas para o período como o Frevo (gim, licor curaçau blue, limão Tahiti e siciliano e Sprite lemon fresh), o Maracatu (gim, maracujá, limão siciliano, mel, hortelã e Schweppes) e outros.Napick up, os mais diversos clássicos do carnaval brasileiro animam a festa.Endereços:Continua após a publicidadeDrosophyla Bar - Rua Nestor Pestana, 163 - ConsolaçãoTelefone Speakeasy - Rua Haddock Lobo, 60 - Cerqueira César.G&T Gin Bar -Rua Oscar freire, 604, Jardins.Quer mais carnaval?O Seen São Paulo apresenta drinques exclusivos para o período carnavalesco, São releituras inusitadas de clássicos de boteco elaboradas pelo head barman, Heitor Marin. As três novas opções são o Rabo de Galo Seen, com cachaça, vermute tinto, Cynar, Agostura Bitter e limão desidratado, o Maria Mole Seen, que leva brandy, vermute seco e bitter de laranja, e o Bombeirinho Seen, trazendo cachaça, xarope artesanal de framboesa, Campari e suco de limão. O Seen fica no Tivoli Mofarrej, na Alameda Santos, 1437 - Jardim Paulista.E mais confete!A Bombay Sapphire, marca de gim pertencente ao Grupo Bacardi, confirmou sua presença no Carnaval da Marquês de Sapucaí, no Rio de Janeiro. Durante os dias 18, 19, 20 e 25, Bombay contará com ativações exclusivas nos camarotes Mar e Allegria. A vodca a Grey Goose também confirmou presença nesses camarotes.Continua após a publicidadeE agora a serpentina:Para quem irá comemorar o carnaval de 2023 na capital paulista, o Camarote Aquarela surge com bares selecionados da cidade e apresentações musicais. Em sua primeira edição no Sambódromo do Anhembi, na Zona Norte de São Paulo, nos dias 17, 18, 19 e 25 de fevereiro o camarote conta com mais de 10 atrações confirmadas - e a presença dos bares da região do Itaim. como Mahau, Amargot, Beco do Espeto, Ruazinha e Aurora. Os ingressos são diários e estão disponíveis no site da Sympla, com valores a partir de R$ 250. Além disso, o evento oferece serviço de van até o Sambódromo."
5,https://www.estadao.com.br/paladar/balcao-do-giba/greenkitchen-volta-com-coqueteis-de-thiago-pereira-conheca-tambem-os-drinques-da-adega-santiago/,"Olá, amigos! Todos bem?O Balcão de hoje fala um pouco sobre a volta da GreenKitchen Brasil.Idealizado pelo casal Fábio e Daniele Zukerman, o restaurante baseado em preparos com alimentação vegetal, abre as portas em Pinheiros, na Rua Benjamim Egas, 275 - próximo ao Sede 261 (bar de vinhos). A inauguração oficial acontece no próximo dia 7.A GreenKitchen, que já tem uma longa trajetória, ficou conhecida pela unidade localizada no centro da cidade - que fechou no fim do ano passado.newsletterPaladarAs melhores críticas gastronômicas, receitas e dicas de bares e restaurantes, às sextas-feiras.inscreverAo se cadastrar nas newsletters, você concorda com osTermos de UsoePolítica de Privacidade.Drinque autoral na GreenKitchen.Foto:  Gustavo SteffenContinua após a publicidadeNa nova casa, o cardápio é assinado pelo chef Vítor Asprino - que traz como destaque sugestões especiais de brunch para os finais de semana.Mas vamos focar no copo. A carta de drinques é assinada pelo premiado mixologista Thiago Pereira, sócio no Koya 88 e o Bar Bagaceira.Dentre as opções há criações como o Lemon Glass Martini (R$ 35) feito gin, suco de capim limão, néctar de maçã verde, limão tahiti e orzata; o Haru (R$ 37) com Jim Beam Black, creme de abacaxi, calda de alecrim, licor de Yuzu, cítricos e bitter de cacau e o Haiboru de melancia (R$ 35) com gin, extrato de gengibre, cítrico e soda de melancia.Continua após a publicidadeClássicos como o Old Fashioned, Negroni e Fitzgerald também estão disponíveis na carta.Coquetel de Thiago Pereira.Foto:  Gustavo SteffenNo Adega SantiagoEssa semana esse balcão também continuou sua missão de descobrir um pouco da coquetelaria feita em restaurantes. Visitei o Adega Santiago - em seu mais recente endereço, noShops Jardins - Rua Haddock Lobo, 1626 - Jardins.Continua após a publicidadeO restaurante tem uma carta que atende todas as suas unidades. Agora, os autorais estão em uma ""pegada verão"". Existe também uma grande variedade de spritz e drinques clássicos. Destaque para as opções de dry martini - o que eu tomei estava ótimo.Dry Martini. Arquivo PessoalFoto:  EstadãoDos autorais, recomendo o Sierra Nevada (R$39) - com rum, triple sec, gengibre, Angostura, siciliano e espuma de chope.Para quem ainda está na onda dos Mules, a opção é o Morenito (R$ 45) - comrum, bourbon, abacaxi,mel, mix cítrico e espuma.Assim como outros restaurantes, a casa não identifica o autor ou autores de cada coquetel criado para casa. A torcida deste blog  é para que os restaurantes passem a creditar os profissionais de bar quando o trabalho for autoral.Sierra Nevada. Arquivo PessoalFoto:  EstadãoContinua após a publicidadeConcursoPelo terceiro ano consecutivo, a Cointreau, marca do licor de laranja mais famoso do mundo, importado pela Interfood para o Brasil, realiza o ""Margarita Challenge"". No dia 22 de fevereiro, serão divulgados os 10 semifinalistas que seguirão para o desafio final no mês de abril, em Paris.LançamentoPara marcar sua expansão, a cachaça orgânica Pindorama lança a série Ouro. No centro do rótulo, desenvolvido por Oveja & Remi, renomado escritório argentino de design, se destaca a imagem de uma mulher, inspirada em Iara, a deusa das águas. Ela encontra-se dentro de uma canoa, levando um barril de cachaça rio acima, acompanhada de um boto-rosa."
