,URL,Conteúdo
6,https://www.estadao.com.br/paladar/balcao-do-giba/no-gran-bar-experimente-o-curto-uma-versao-de-bloody-mary-com-com-agua-de-tomate-temperado-e-molho-de-ostra/,"Olá amigos,todos bem?Essa semana visitei oGran Bar Bernacca, no Itaim. O lugar acabou de lançar uma carta com 12 drinques autorais da bartenderAna Gumieri- que considero uma das mais talentosas desta nova geração de profissionais do bar.Ana Gumieri no Gran Bar.Foto:  Tati FrisonnewsletterPaladarAs melhores críticas gastronômicas, receitas e dicas de bares e restaurantes, às sextas-feiras.inscreverAo se cadastrar nas newsletters, você concorda com osTermos de UsoePolítica de Privacidade.Continua após a publicidadeA casa é super charmosa e, recentemente, ampliou o espaço do balcão - o que deixa o Gran Bar muito mais atraente para os aficionados em coquetelaria.Nas noites do Gran Bar, quem está executando os coquetéis criados pela Ana é o Yuri Kenji (preciso nas execuções).Yuri Kenji com o coquetell ' Equilíbrio'. Foto Arquivo PessoalA carta tem muita coisa interessante. Mas eu quero destacar dois coquetéis: o Curto e o Koji Dirty.Continua após a publicidadeO primeiro é uma variação de Bloody Mary - com água de tomate temperado com molho de ostra, limão siciliano, jerez fino e sorbet de salsão.Coquetel 'Curto', uma versão de Bloody MaryFoto:  Tati FrisonOutro que merece ser conhecido é o  Koji Dirty. O drinque leva Awamori. Trata-se de uma bebida destilada japonesa produzida exclusivamente na ilha de Okinawa, no extremo-sul do arquipélago nipônico.  Além do Awamori, o Koji Dirty vai com Cherry Heering, bitter artesanal de katsuobushi e algodão salgadoPara a turma que prefere algo com menos puch alcoólico, eu indico, além do Curto, o Catalão, com blend de vermutes, jerez oloroso, licor maraschino e vodca.Continua após a publicidadeDrinque autoral da carta do Gran Bar. Foto Tati FrisonJá para quem prefere algo mais potente, eu iria de Equilíbrio, coquetel que leva bourbon, licor benedictine, chá branco, defumação de cranberry e chocolate branco (é como se fosse um highball sem carbonatação).O Gran Bar Bernacca fica na Rua Amauri, 244, no Itaim Bibi.O Gran Bar fica no Itaim. Foto. Arquivo PessoalContinua após a publicidadeNOTÍCIASJAZZ E UÍSQUEO Picco, bar localizado na rua Lisboa no bairro de Pinheiros, é a primeira embaixada do single malt The Glenlivet no Brasil. Marca passa a assinar as sessões de jazz realizadas na casa, além de apoiar o lançamento do Selo Vitrine com foco em novos expoentes da música instrumental.CAMPARI BARTENDER COMPETITIONContinua após a publicidadeA terceira edição do Campari Bartender Competition já tem os nomes dos 15 semifinalistas que disputarão uma viagem à Itália e um contrato anual com a marca. Eles estão alocados em bares de São Paulo, Rio de Janeiro, Santa Catarina, Sergipe, Distrito Federal e Rio Grande do Sul e seus respectivos drinquespoderão ser experimentados pelo consumidor e votados nas casas até o dia 14, quando os 3 finalistas serão anunciados."
7,https://www.estadao.com.br/paladar/balcao-do-giba/voce-ja-experimentou-uma-caipirinha-suja-no-bargo-mooca-tem/,"Amigos do Balcão, todos bem?Essa é a última coluna antes das minhas férias. Vou ficar 3 semaninhas fora - mas volto com energias renovadas.Para essa saideira virtual, vamos falar um pouco do Bargo Mooca, localizado embaixo do Borgo Mooca.Ah, sim, importante detalhe. Ele não é mais um bar na Mooca. Agora, o Bargo Mooca é na... Santa Cecília - mais especificamente na rua Barão de Tatuí, 302.Já ouviu falar em caipirinha suja?Foto:  Gilberto AmendolaA carta de coquetéis é de Danilo Nakamura (Sucrilhos) e do Jota Bê. Quando visitei a casa quem estava no comando das coqueteleiras era o ‘atleta de balcão’ João Piccolo.newsletterPaladarAs melhores críticas gastronômicas, receitas e dicas de bares e restaurantes, às sextas-feiras.inscreverAo se cadastrar nas newsletters, você concorda com osTermos de UsoePolítica de Privacidade.Por lá, tomei o drinque Rabo de Galo de Jerez - que como o próprio nome já entrega é cachaça, vermute tinto, cynar e...jerez!Continua após a publicidadeOs coquetéis mais surpreendentes foram: Dryquiri e a Caipirinha Suja.O Dryquiri é um daiquiri com um toque de maracujá. Não deve ser fácil de equilibrar, mas o meu drinque estava excelente.Dryquiri.Foto:  Gilberto Amendola/Arquivo PessoalJá a Caipirinha Suja é uma ótima ideia. Trata-se uma caipirinha tradicional de limão com um toque (uma ‘sujada’) com fernet. Se você curte um Macunaíma, vai gostar desta intervenção na caipirinha também.Ah, não vá embora sem experimentar a “Batida Bargo” - coquetel que leva gim, Maracujá e Shissô.João Piccolo no preparo dos coquetéis.Foto:  Gilberto Amendola/Arquivo PessoalContinua após a publicidadeDrinks do BemA comunidade de bartenders de SP está mobilizada para ajudar as vítimas da tragédia no litoral norte. Neste domingo, dia 26, na sede da Abrasel (rua Itápolis, 1468 - Pacaembu), alguns dos principais bartenders da cidade irão preparar coquetéis em troca de doações. Das 13h às 18h."
8,https://www.estadao.com.br/paladar/balcao-do-giba/liz-cocktails-co-vai-lancar-carta-baseada-em-classicos-do-cinema-no-dia-do-oscar/,"Olá amigos,todos bem?Vamos viajar para o Rio de Janeiro.OLiz Cocktails & Colança no dia 12 de março, não por acaso o dia doOscar, uma carta dedicada aos clássicos do cinema.newsletterPaladarAs melhores críticas gastronômicas, receitas e dicas de bares e restaurantes, às sextas-feiras.inscreverAo se cadastrar nas newsletters, você concorda com osTermos de UsoePolítica de Privacidade.Não é apenas uma carta de drinques baseados em filmes, mas toda uma pesquisa envolvendo cenas clássicas, os drinques que fazem parte destas cenas e variações autorais destes drinques.Continua após a publicidadeAlém da própria carta, a casa também criou quadros, posters, postais e 'bolachas' com o mesmo tema.""Coquetelaria e cinema sempre estiveram conectados. É uma relação que toca no lado emocional das pessoas"", disse Tai Barbin, proprietário e fundador do Liz.Na carta, são 12 filmes e séries - que partem de 1942(Casablanca) até 2019 com o (Once Upon a Time in Hollywood- longa do Quentin Tarantino).A Marselhesa.Foto:  Taís BarrosContinua após a publicidadePara cada filme (ou série), existe o coquetel clássico referenciado na obra e uma versão autoral.  O capricho do cardápio vai elevar o patamar das apresentações de carta daqui pra frente. Além de mostrar filme e coquetéis, ele ainda detalha a cena em que a bebida aparece e fala sobre a origem do drinque.Vamos de alguns exemplos:Do já citadoCasablanca, o drinque é o French 75. No filme, o coquetel surge em uma cena em flasback em que Paris é invadida pelo exército nazista enquanto Humphrey Bogart e Ingrid Bergan brindam com um French 75 ( Brandy, triple sec, espumante e limão siciliano).Continua após a publicidadeComo variação, a casa apresenta o  As Time Goes By, que mantém a estrutura do French 75, mas leva o vinho verdejo, especiarias e espumante.Outro exemplo é o doPoderoso Chefão 2. Como clássico, a casa traz o Daiquiri (  Rum branco, limão taiti e açúcar) - que aparece na sequência em que Corleone em Cuba, às vésperas da revolução, pergunta  como deve pronunciar o nome do coquetel típico da ilha.Lança Chamas.Foto:  Taís BarrosComo versão da casa, o Liz apresenta o  You Can't Refuse - que leva rum branco infusionado com banana, cachaça, óleos essenciais da casca da banana e limão taiti.Continua após a publicidadeUm exemplo de série é, claro, tinha que ser original deMad Men. O drinque que aparece na série (muitas vezes) é o Old Fashioned ( Bourbon, açúcar e bitters). Na série, ele se destaca na cena em que  Don Draper, hospedado em um hotel, aborda o bartender e o ensina a sua receita de Old Fashioned, preparando ele mesmo o coquetel. A versão da casa para o Old é o  O Pensador - com blend de runs, vermute rosso, dom benedictine, café, feno-grego, cacau, charuto e bitters.O Pesador.Foto:  Taís BarrosEm tempo, o Liz também será a embaixada oficial do uísque Chivas no Rio de Janeiro.Continua após a publicidadeO Liz fica na Rua Dias Ferreira, 679, no Leblon - Rio de Janeiro.All In.Foto:  Taís Barros"
9,https://www.estadao.com.br/paladar/balcao-do-giba/passeio-etilico-pelo-centro-de-sp-a-coquetelaria-do-cineclube-cortina-do-fel-e-infini-bar/,"Olá, amigosTodos bem?Aproveitei os últimos dias de 2022 e o comecinho de 2023 para preencher algumas lacunas etílicas. Eu, por exemplo, ainda não tinha visitado o bar do centro cultural Cineclube Cortina. Além disso, fazia uma eternidade que eu não encostava esse cotovelo no charmoso balcão do Fel, bar que fica embaixo do edifício Copan, e  também no concorrido Infini Bar, que fica dentro do tradicional restauranteLa Casserole.Vamos começar pelo Cortina. O lugar conta com a coquetelaria da hermana Chula - que construiu uma carta brincando com clássicos do cinema. No dia da minha visita, fui atendido por dois ótimos nomes da equipe: Laís Ladrine e Saulo Silva.Bar do Cineclube Cortina. Arquivo PessoalFoto:  EstadãoO bar é grande, mas costuma encher antes dos shows (principalmente aqueles com muita procura). Quem prefere um bar um pouco mais vazio pode chegar depois dos shows começarem (mas o burburinho da casa cheia é um charme).newsletterPaladarAs melhores críticas gastronômicas, receitas e dicas de bares e restaurantes, às sextas-feiras.inscreverAo se cadastrar nas newsletters, você concorda com osTermos de UsoePolítica de Privacidade.Gostei bastante do ""Milk Punch de Guys and Dolls"" (com rum, abacaxi, coco tostado, limão e especiarias) e do refrescante  e muito pedido ""French 75 de Casablanca (com gim, açúcar de coentro, limão e vinho branco). Para os mais audaciosos, o coquetel que é uma mistura de negroni com dirty martini, o desafiador ""Se Negroni do Estômago Fosse Um Dirty Martini (ele leva cachaça branca, água de pepino, vermute dry, jerez de maçã, sorvete de gorgonzola e goiaba e picles caseiro.  Outra boa pedida no Cortina é pedir clássicos - todos saem perfeitamente equilibrados.Continua após a publicidadeLaís Ladrine. Arquivo PessoalFoto:  EstadãoJá no início do ano, abri os trabalhos de bar visitando o Fel - casa que não frequentava há muito tempo . A casa, de pouquíssimos lugares, continua charmosa e com uma trilha sonora de cortar o coração. Para achar um lugar no balcão, o ideal é chegar antes das 19h (abre às 17h) e contar com a sorte para pegar o contra fluxo de clientes.O Fel continua sendo um templo para os nerds da coquetelaria, aqueles que buscam coqueteis esquecidos pelo tempo. A carta tem, por exemplo, drinques de 1827, como o Brown Betty. Recomendo aos iniciados (ou nem tanto), o Triglav (coquetel de 1921 com rum, vermute tinto, Grand Marnier e Angustura).Também gostei do Rusa Dry (de 1943 - com vodca, gim, vermute tinto e angustura). Outra pedida interessante é o My Hope (criado em 1922 - com conhaque, Graham's Extra Dry White, Angostura e Páprica.Em tempo, o Cortina e o Fel ficam próximos. Se você estiver com sede e na ""missão"" de reconhecer ou revisitar bares, é possível visitar as duas casas em uma só noite.Coquetéis do passado no Fel. Arquivo PessoalFoto:  EstadãoMas você também pode chamar um aplicativo e (depois de uma curtíssima viagem) chegar ao restauranteLa Casserole, no Largo do Arouche. Lá, fica o Infini Bar. Minha última visita ao local foi no dia da sua inauguração - ainda em um mundo pré-pandemia.O bar tem uma pegada que ao mesmo tempo parece retrô e futurista - acho que depende de quantos drinques você vai tomar.Continua após a publicidadeEspelhos por todos os lados no Infini. Arquivo PessoalFoto:  EstadãoHoje, o chef de bar é o Rodrigo Roso (ex-Boca de Ouro). Roso, aliás, está preparando uma carta autoral para o Infini - que deve ser lançada em março. No dia em que estive lá, Roso estava de folga, mas fui muito bem atendido pelo Vitor Demion. Recomendo o Um Corpo Que Cai (gim, vermute seco, Poire Williams, Angostura e amargos de limão cravo e o Old Man (com vermute tinto, amaro, angostura e tintura de kaffir.O Cortina fica na Rua Araújo, 62O Fel fica na Avenida Ipiranga, 200 (embaixo do Copan)O Infini está no Largo do Arouche, 346 - RepúblicaTrilha sonora perfeita no Fel. Arquivo PessoalFoto:  EstadãoNotíciaQue tal drinques de cachaça neste verão? O  Fechado Café e Bar apresenta o Frutífero, feito a base de cachaça Pindorama , calda de cupuaçu, frutas amarelas e espuma de mate com limão para dar refrescância (R$34)."
10,https://www.estadao.com.br/paladar/balcao-do-giba/a-coquetelaria-de-dois-achados-de-sp-o-mapu-e-o-shoshana-delishop/,"Olá, amigostodos bem?Essa é a última coluna do ano. O Balcão vai tirar uma semaninha para recuperar o fígado (ops), as energias, e retomar na primeira sexta-feira de janeiro.Hoje, quero indicar dois lugares que visitei neste fim de ano e que foram ótimas surpresas:o Mapue oShoshana Delishop- restaurantes com coquetelaria de alto nível.newsletterPaladarAs melhores críticas gastronômicas, receitas e dicas de bares e restaurantes, às sextas-feiras.inscreverAo se cadastrar nas newsletters, você concorda com osTermos de UsoePolítica de Privacidade.Continua após a publicidadeVou começar pelo Mapu, restaurante de cozinha taiwanesa na Vila Mariana. O responsável pelos drinques da casa é o excelente Maurício Barbosa ( que já esteve à frente da coquetelaria do Tuju, por exemplo). Tão genial quanto discreto, Barbosa não frequenta a badalação do mundo dos bartenders, mas sempre entrega um trabalho impecável.Criação de Maurício Barbosa.Arquivo PessoalFoto:  EstadãoNo Mapu, destaque para o Milkfish, um milk punch com spiced rum, licor de laranja, falernum de amêndoas, chá assam, maçã e limão.Também não deixe de experimentar dois drinques surpreendes como cachaça: o  Larissau - com cachaça envelhecida em carvalho, vermute, mel de cacau, limão, bitter de laranja e café; e o Chora Que Ela Volta - com  cachaça envelhecida em carvalho, jerez fino, lillet, mel mandaguari e sal de shissô.Continua após a publicidadeNo Mapu, não existe um balcão. Os coquetéis são preparados em um cantinho perto da cozinha (o que não é problema nenhum). Mas, em 2023, Maurício deve ter um bar para chamar de seu (dos mesmos donos do Mapu).Drinques do Mapu. Arquivo PessoalFoto:  EstadãoJá o Shoshana, um dos lugares imperdíveis do Bom Retiro (cozinha judaica), tem a coquetelaria de Günter Sarfert (aqui, conectada com as raízes judaicas). Para fãs de martinis, recomendo (com entusiasmo) o Mensch Martini (vodca infusionada com azeite, gim, vermute seco e salmoura de picles).Continua após a publicidadePara os fãs de martinis. Arquivo PessoalFoto:  EstadãoOutro destaque é o Heschel (aqui, para os aficionados por old fashioned). O coquetel leva bourbon, Krupnik (feito na casa - com  vodca, mel e especiarias), vodca e Cynar 70.Mapu e Shoshana são dois achados da cidade. As duas casas já têm o merecido reconhecimento pela gastronomia. Agora, merecem também uma visita de quem tem paixão por coquetelaria.Mapu:R. Áurea, 267 - Vila MarianaContinua após a publicidadeShoshana:R. Correia de Melo, 206, Bom Retiro.Uma versão de oldfashioned. Arquivo Pessoal.Foto:  EstadãoNotíciasLançamentoA Brown-Forman traz o Fords Gin ao Brasil. Desenvolvida no Sul de Londres por Charles Maxwell e Simon Ford, duas das mais reconhecidas personalidades mundiais da indústria de gim, e por um seleto grupo de bartenders, a bebida combina nove botânicos. Além do tradicional zimbro, o Fords Gin também leva semente de coentro, frutas cítricas (laranja amarga, limão e casca de toranja), florais (flor de jasmim e lírio) e especiarias (raiz de angélica e cássia).Continua após a publicidadeLançamento 2Freixenet, maior produtora de Cavas no mundo, acaba de anunciar o lançamento de edições limitadas dos clássicos Cordón Negro e Carta Nevada para as festas de fim de ano."
11,https://www.estadao.com.br/paladar/balcao-do-giba/conheca-a-coquetelaria-do-viro-bistro-nova-casa-no-baixo-augusta/,"Olá,amigos.Todos bem?Sim, eu sei. Acabamos de sair de uma Copa do Mundo.Apesar da tristeza, esse é mais um motivo para conhecer um novo bar na cidade.Bola pra frente!newsletterPaladarAs melhores críticas gastronômicas, receitas e dicas de bares e restaurantes, às sextas-feiras.inscreverAo se cadastrar nas newsletters, você concorda com osTermos de UsoePolítica de Privacidade.Continua após a publicidadeHoje vamos conhecer o Virô Bistrô - casa que abriu no endereço do antigoBar Tubaína(lugar de onde costumava sair o saudoso Bloco Soviético durante o carnaval de São Paulo).Mas chega de saudosismo e vamos falar das novidades.Ambiente do Virô Bistrô. Crédito: DivulgaçãoFoto:  EstadãoO Virô Bistrô fica no Baixo Augusta e é comandado pelo restaurateurLalo Zanini. A carta de coquetéis é de responsabilidade do mixologista Marcelo Serrano.  Na carta, 18 drinques (entre alcoólicos e não alcoólicos).Continua após a publicidadeCom apelo para virar um hit, Marcelo apresenta oViro Bellini, que leva gin, rosas, toranja, espumante, espuma de gengibre e caviar de blueberry (fácil, fácil de beber).Para os fãs de Fitzgerald (drinque que continua bombando em SP -  e leva gim, suco de limão siciliano, xarope de açúcar e Angostura), minha sugestão é experimentar o La Belle De Jour (gim de pêra, lillet blanc, maçã verde e physalis).Drinques fáceis de beber. Crédito: Andres CostaFoto:  EstadãoContinua após a publicidadeCurti bastante o Pisco Punch (pisco, maracujá, amêndoas, limão) e o Intenso - que entrega tudo o que o nome promete, com cachaça envelhecida , amaro , amaretto, vermute rosso e alcaparrone.Claro, Marcelo levou para casa o seu Moscow Mule. Se alguém ainda não sabe, ele é o criador do Moscow Mule Brasileiro(aquele com espuminha).Coquetel Intenso. Crédito Andres CostaFoto:  EstadãoO Virô Bistrô fica na Rua Haddock Lobo, 74 - Cerqueira César.Continua após a publicidadeAh, curiosidade. O recém-aberto Telefone, que também tem carta de Marcelo Serrano, fica em cima do Virô Bistrô.Robusto. Andres CostaFoto:  EstadãoNotíciasConcurso Rabo de GaloO 5° Concurso Nacional de Rabo de Galo acontecerá no dia 12 de dezembro, no Hotel Leques Brasil, na rua São Joaquim, 216 - Liberdade SP. Segundo um dos pioneiros da coquetelaria brasileira  e um dos organizadores do evento, Derivan Ferreira, o objetivo do evento ""é potencializar a importância do rabo de galo, sobretudo internacionalmente, possibilitando sua inserção na lista da IBA - International Bartenders Association"".200 CachaçasContinua após a publicidadeComo parte das comemorações do Bicentenário da Independência do Brasil, o Ministério da Agricultura, Pecuária e Abastecimento (Mapa), lançou o livro ""200 anos- 200 cachaças - A evolução da cachaça, da Independência aos dias de hoje, contada em 200 rótulos"" . A edição é de  Andréia Gerk,  Milton Lima, Luiz Arkhan e Jairo Marns.Festa do GuilhotinaGuilhotina celebra seis anos de vida  com bartenders convidados. Na próxima quarta, dia 14, nomes de destaque da coquetelaria  vão apresentar suas criações nesse famoso balcão. Às 18h, quem assume as coqueteleiras é Deivisson Arruda, da Sweet Secrets. Às 19h é a vez de Gustavo Ribeiro, do Santana Bar, e, na sequência, às 20h, Cristiana Negreiros desce do Carrasco para o balcão do Guilhotina. Ainda tem Alex Sepulchro, do SubAstor (21h), Ana Gumieri, do Gran Bar Bernacca (22h) e, para fechar a noite, Alison Oliveira, que vem diretamente do Caledonia Whisky&Co., das 23h até meia-noite. Por todo esse período, a equipe do Guilhotina vai seguir sob o comando de Spencer Amereno Jr. no preparo dos coquetéis que integram a carta regular da casa. Guilhotina Bar. Rua Costa Carvalho, 84 - Pinheiros.Festa do High LineO High Line Bar comemora sete anos no sábado  com um line-up repleto de nomes que fazem parte da trajetória do espaço. Entre os convidados estão Maz, Felipe Lima, Gianni Petrarca, Biro Berla vs Soulmanic, Dre Guazzelli, DOM7NICO e Jason, além do curador, sócio e DJ residente da casa, Leo Cury. Rua Girassol, 144 - Vila Madalena."
12,https://www.estadao.com.br/paladar/balcao-do-giba/conheca-alquimia-a-nova-carta-de-coqueteis-do-bar-do-lobby-do-grand-hyatt/,"Olá, amigos. Todos bem?Depois de muito tempo, voltamos com um vídeo para o nosso balcão (parceria com o Direto da Fonte).Desta vez, visitamos o Grand Hyatt São Paulo. O bar do hotel acaba de lançar a carta Alquimia, construída com a mentoria do mixologista Alex Mesquita.Aos poucos, o Hyatt vem se notabilizando por  tratar a coquetelaria com seriedade. A carta anterior, por exemplo, era de um grande nome do mercado, o Gustavo Rômulo (que hoje está no bar do JW Marriott São Paulo).newsletterPaladarAs melhores críticas gastronômicas, receitas e dicas de bares e restaurantes, às sextas-feiras.inscreverAo se cadastrar nas newsletters, você concorda com osTermos de UsoePolítica de Privacidade.Continua após a publicidadeAlex Mesquita e equipe. Tiago QueirozFoto:  EstadãoAssista ao vídeo:Abaixo o texto (com complementos) publicado no Direto da Fonte:No lobby doGrand Hyatt São Paulo, a poucos passos da recepção, fica um discreto (mas excelente) bar de coquetelaria. Aberto também aos não hóspedes, o lugar  acaba de lançar uma nova carta de drinques.Com mentoria Alex Mesquita, um dos nomes mais importantes da mixologista brasileira (responsável, por exemplo,pela carta do Tan Tan - único bar brasileiro na prestigiada lista The World's 50 Best Bars2022), o novo menu apresenta 10 coquetéis autorais e uma série de clássicos.Continua após a publicidade""Os hotéis são espaços nobres para o desenvolvimento da coquetelaria. Você encontra clientes de todas as partes do mundo - e pode criar uma cultura de consumo"", disse Mesquita.Sexy Lady. Tiago QueirozFoto:  EstadãoCom a supervisão de Mesquita, a equipe do bar  ( Anderson Nascimento, Victor Ferraz, Daniel Andrade, Fernando Carvalho e Thiago Xavier ) desenvolveu coqueteis como Pure Love (gim, fernet, cordial de morango e limão ) e Puscho (pisco, licor de laranja, limão, mel maracujá e hortelã).Gostei bastante também do Gallo de Jerez - com cachaça, jerez fino e jerez oloroso - e do Spice Mango Daiquiri - com rum, purê de manga com coco, limão e pimenta dedo de moça.Mas a aposta da casa é a volta de um clássico, o Old Cuban - que leva rum envelhecido, limão, xarope de açúcar, bitter hortelã e espumante brut. Os preços variam entre R$ 44 e R$ 58.Old Cubam. Tiago QueirozFoto:  EstadãoContinua após a publicidadeO espaço do bar, que hoje é dividido com um ótimo restaurante japonês, deve passar por uma reforma em breve - o que deve valorizar ainda mais a coquetelaria no lobby do hotel.O Grand Hyatt fica na Av. das Nações Unidas, 13301 - Itaim Bibi.Alex Mesquita. Tiago QueirozFoto:  Estadão"
