,URL,Conteúdo
13,https://www.estadao.com.br/paladar/balcao-do-giba/o-jeito-frank-sinatra-de-ser-do-novo-the-s/,"Olá,meus amigos.Todos bem?Hoje vamos falar do The S., bar recém-instalado no Circolo Italiano, na região central de São Paulo. Em clima de clube de jazz, a casa tem um jeito Frank Sinatra de ser (o S. do seu nome é, claro, de Sinatra).newsletterPaladarAs melhores críticas gastronômicas, receitas e dicas de bares e restaurantes, às sextas-feiras.inscreverAo se cadastrar nas newsletters, você concorda com osTermos de UsoePolítica de Privacidade.Neste prédio icônico da Avenida Ipiranga, o cliente se sente  quase que como parte do Rat Pack (grupo formado nos anos 50 e 60 por nomes como o do próprio Frank Sinatra, Dean Martin, Sammy Davis Jr. e outros).Continua após a publicidadeO jeito Frank Sinatra de ser.Foto:  Rodolfo Regini.Sim, Sinatra era dos nossos e gostava de um drinque. O artista era fã confesso de Jack Daniel's. Não à toa, um dos diferenciais do The S. é servir o  Sinatra Select - o rótulo da Jack que homenageia o cantor (que sem me aventurar em muito tecnicismo, trata-se de um Jack que passou por barris com ranhuras mais profundas - para expor a bebida às camadas extras de carvalho tostado).Sinatra Select. DivulgaçãoFoto:  EstadãoContinua após a publicidadeAlém do Sinatra Select, a casa conta, claro, com outros uísques. A coquetelaria fica por conta domixologista Bruno Medeiros. Alguns coquetéis, como oUnder My Skin (Jack, redução de mel e abacaxi, xarope de agave, limão siciliano e angostura), seguem  a proposta de homenagear o artista.As músicas de Sinatra batizam parte da carta, como Fly Me to The Moon ( The Botanist Gin, xarope de maracujá, grenadine, espuma de maracujá e tônica) e o My Way - gim, suco de limão taiti, suco de grapefruit, xarope de toranja, alecrim e angostura). O já citado Rat Pack batiza o negroni envelhecido em barril de carvalho.Músicas de Sinatra batizam os coquetéis.Foto:  Rodolfo ReginiThe S.Avenida Ipiranga, 344 - Circolo Italiano - 1 andar. Horário de funcionamento, de quinta a sábado, das 16h às 2h. @thes_bar.Continua após a publicidadeBar fica em prédio icônico do centro.Foto:  Rodolfo ReginiNOTÍCIASPARA COMER COM A MÃOContinua após a publicidadeO Santana Bar passou a oferecer opção de comidinhas para acompanhar sua premiada carta de drinques. Fábio Moon é o responsável por ela - e trouxe elementos de cidades como Barcelona, Lisboa e a região da Provence, no sul da França.Os pratos foram pensados para se compartilhar e comer com as mãos e buscam harmonizar com os drinques da casa. Do mar, aparecem o Mexilhão Escabeche (R$39), as Rilletes de Salmão (R$45), Gildas (R$23) e o Club Sandwich de Camarão (R$59). Da terra, o Torresmo (R$32), o Tartare de Carne (R$43) e a tábua de Charcuterie (R$89). Há também opções para os vegetarianos, como o Nori Frito R$37) e a torta de tomate (R$42)."
14,https://www.estadao.com.br/paladar/balcao-do-giba/a-coquetelaria-de-inspiracao-japonesa-do-imakay/,referencereferencereferencereference
15,https://www.estadao.com.br/paladar/balcao-do-giba/punk-cuisine-chega-aos-jardins-com-coquetelaria-sofisticada/,"Olá, amigos!Todos bem?Finalmente chegou aquela semana que o mundo da coquetelaria brasileiro estava esperando... Nos dias 5 e 6 de junho, no Pavilhão da Bienal, acontece aBar Convent (BCB). Trata-se da maior feira de coquetelaria, bares e marcas do País. Neste ano, um dos convidados internacionais é oNico de Soto, uma das grandes estrelas do setor e dono do bar Mace, em NY. Aliás, leia aqui neste post uma entrevista exclusiva com o Nico.Mas antes vamos seguir nossa tradição e apresentar um bar novo na cidade. Desta vez, vamos indicar o bar/restaurantePunk Cuisine. A casa é originalmente de Curitiba, mas acaba de desembarcar em São Paulo - mais especificamente na Alameda Tietê.Punk Cuisine chega em São PauloFoto:  Tati FrissonO Punk Cuisine é comandado por Arthur Maia, Rafael Kac e Fred Sabbag, que também é sócio no Flora Bar.newsletterPaladarAs melhores críticas gastronômicas, receitas e dicas de bares e restaurantes, às sextas-feiras.inscreverAo se cadastrar nas newsletters, você concorda com osTermos de UsoePolítica de Privacidade.Os drinques foram concebidos pelo ótimo Vinicius Kodama - e são bem executados pela equipe do bar.Continua após a publicidadeDestaque para o High and Dry (um martini com saquê, shochu, luxardo, umeboshi e rakkyo). Curioso como esse coquetel quebra a expectativa de quem apenas lê sua descrição. Não, ele não é ‘pesado’ ou excessivamente ‘potente’. É bonito de ver (experimentar) algo tão equilibrado. Um dos ótimos drinques da temporada até agora.O clássico NY Sour também é um dos sucessos da casa.Aliás, a casa consegue amarrar o moderno com o aconchegante - um projeto do arquiteto Paulo Peruzzo. A cozinha fica por conta da chef Gabi Monteiro.Coquetel equilibradoFoto:  tati frisonNa Alameda Tietê, 184.Entrevista: Nico de SotoParisiense, Nico de Soto iniciou sua carreira em 2005 e tem mais de 50 prêmios, o mais recente deles no The World’s 50 Best Bar de 2022, com o seu bar Mace, em Nova York.Continua após a publicidadeConsiderado um dos bartenders mais influentes do mundo, ele tem expertise na arte da coquetelaria clássica atrelada a inspiração da mixologia e técnicas modernas.Durante a BCB, Nico fará uma apresentação sobre os novos hábitos de consumo dentro da coquetelaria e as tendências de coquetéis não alcoólicos, além de trocar experiências com os demais bartenders do evento em relação ao xaropeMathieu Teisseire.Nico de SotoFoto:  ANDREW ZAEH1. Quais são suas expectativas em relação ao mercado brasileiro de coquetéis?Eu já fui a bares em São Paulo e já fui a bares no Rio de Janeiro. Então, eu fiz um guest no Guilhotina alguns anos atrás. Então eu sei que São Paulo é uma cena muito boa, tem bons bartenders, é criativo... Eu espero encontrar algo ainda melhor. Eu sei como os bartenders são apaixonados. O legal é que tem muito produto legal no mercado brasileiro...2. Como você vê o mercado mundial de coquetéis no pós-pandemia?Para ser honesto, está indo bem. Tenho viajado bastante desde o pandemia. E eu acho que em todos os lugares, quando as coisas reabriram, as pessoas estavam prontas para beber. E os bares estavam muito cheios. Na Europa e em Nova York, nós batemos os recordes o tempo todo.  Claro que tem alguns bares que sofreram e fecharam por causa da pandemia . Mas, nesse tipo de indústria, no microcosmo  que nós somos, todo mundo ainda está lá, todo mundo ainda tem sua barra. Estão todos ocupados e parecem muito felizes.Continua após a publicidade3. Quais tendências você acredita que veremos no futuro?Esta é uma pergunta que não faço ideia. Você sabe, sempre respondo essa pergunta. Ainda estamos no momento do coquetel sustentável, no baixo teor alcóolico. Então, eu acho que  vai ser um reforço disso, sabe, Mais e mais pessoas estão trabalhando com produtos locais. Em termos de bebidas há muito gins. Acho que o saquê e o soju estão ficando cada vez maiores. também.4. Você notou um aumento no interesse do público em obter conhecimento para fazer drinques em casa?Na verdade, não. Isto é o que eu penso. Talvez eu esteja errado, mas não sei. Não, eu não vi alguma diferença. Acho que as pessoas gostam de beber em bar, gostam de beber em grupo. Claro, tem os prontos para beber, há muitos prontos para beber no mercado agora, e estão funcionando. As pessoas bebem em casa, mas acho que precisam de algo que já está pronto para beber. Ou vão aos bares."
16,https://www.estadao.com.br/paladar/balcao-do-giba/coquetelaria-com-espirito-italiano-no-restaurante-donna/,"Olá, amigosTodos bem?O Balcão de hoje vai contar um pouco sobre a experiência etílica no restaurante Donna, dochefAndré Mifano.Para conhecer a gastronomia dacasa,clique aqui.Do nosso lado, vamos focar na coquetelaria. O responsável pela carta do Donna é o Vini Lopes, bartender e cientista político em formação.newsletterPaladarAs melhores críticas gastronômicas, receitas e dicas de bares e restaurantes, às sextas-feiras.inscreverAo se cadastrar nas newsletters, você concorda com osTermos de UsoePolítica de Privacidade.Assim como a cozinha do Donna, a coquetelaria da casa tem um ""espírito italiano"".Continua após a publicidadeUm bom exemplo desta vertente é o Margaretti, uma versão de Margarita com um toque de limoncello. Uma boa pedida para começar a noite  - independentemente dos próximos passos (você pode, por exemplo, começar com um Margaretti e seguir com as opções de vinho).Margaretti.Foto:  Bia FortesAinda na seara da leveza, outra opção interessante é o Dominic Decocco.  Trata-se de um coquetel clarificado com brandy, rum, Cointreau, coco e limão taiti.Dominic Decocco.Foto:  Bia FortesContinua após a publicidadePara quem procura um pouco mais de corpo no coquetel (mais punch e teor alcoólico), a pedida é o Santino. Picante, o drinque leva bourbon, vermute seco, Amaretto e pimenta.Santino.Foto:  Bia FortesMas o meu preferido da noite foi o Matilde - que leva vermute seco, jerez oloroso, Peychaud's Bitter e Angostura. Neste drinque, Vini promove o encontro da Itália com a Espanha (e deixa o jerez brilhar no copo).Continua após a publicidadeO Donna fica na Rua Peixoto Gomide, 1815. Jardins.Matilde.Foto:  Bia FortesNOTÍCIASDireto da RomêniaChegou ao mercado brasileiro o Alexandrion, um brandy produzido na Romênia. Segundo o embaixador da marca, o mixologista Sylas Rocha, a ideia é incentivar o uso do produto, com características mediterrâneas, nos bares de coquetelaria. A bebida está sendo vendida por preços que variam de R$110 a R$130.Continua após a publicidadeFoto:  EstadãoSylas é quem traz duas receitas com o Alexandrion:Alexandrion Sazerac60 ml Alexandrion 7 1 torrão de açúcar 3 dash de Bitter Peychaud's 1 dash de Bitter de chocolate Mexido, servir em copo baixo sem gelo Aromatizar com absinto*Continua após a publicidadeAlexandrion Highball45 ml de Alexandrion 7 Completar com soda artesanal de Cambuci Montado, servir em um copo long com gelo, finalizar com zest de limãoSylas Rocha.Foto:  Léo FeltranGIM NA COPAA BEG Gin criou uma edição limitada de garrafas para a Copa do Mundo com 5 versões em homenagem aos anos em que o Brasil foi campeão (1958, 1962, 1970, 1994 e 2002). Nos rótulos, informações sobre cada final de campeonato vencida como o local disputado, os gols, as datas e os times.Continua após a publicidadeTAMANHO CERTOAperol uniu-se à Salton para disponibilizar uma versão reduzida do famoso espumante Brut. Com 375ml, a novidade oferece a quantidade ideal da bebida para o preparo do Aperol Spritz em casa."
17,https://www.estadao.com.br/paladar/balcao-do-giba/conheca-o-no-barbie-girl-um-coquetel-inspirado-nos-tradicionais-milkshakes/,"Olá, amigos. Todos bem?Nesta quinta-feira, a coquetelaria brasileira perdeu uma das suas maiores referências. Perdemos oMestre Derivan.Derivan Ferreira de Souza foi pioneiro, desbravou o 'mundão' dos coquetéis em uma época em que tudo era mato neste setor. No tempo em que os profissionais não tinham o equipamento adequado, as melhores bebidas quase não chegavam por aqui e, principalmente, o brasileiro ainda não tinha desenvolvido uma cultura etílica.Mestre Derivan no Blue Note. Crédito: Iara MorselliMas Derivan nunca deixou de sacudir as coqueteleiras. Sempre que cruzei com ele, encontrei um profissional animado e cheio de energia.Uma das coisas mais emocionantes de se ver era a entrega do 'Mestre' durante as edições do Concurso Rabo de Galo.newsletterPaladarAs melhores críticas gastronômicas, receitas e dicas de bares e restaurantes, às sextas-feiras.inscreverAo se cadastrar nas newsletters, você concorda com osTermos de UsoePolítica de Privacidade.Escrevi para minha outra coluna aqui no jornal a notícia da partida de Derivan. Nesta apuração, ouvi do consultor de bares e marcas, Rafael Mariachi, que aquela quinta-feira era o dia mais triste da coquetelaria brasileira.Continua após a publicidadeFoi mesmo.Mas o que o Mestre gostaria é que a gente não deixasse a coqueteleira cair. Com a benção do Mestre Derivan, nós seguimos.Leia aqui a matéria publicada na quinta-feira.Seguimos com as novidades por aqui.Daisy NightsO Hey Daisy, restaurante especializado em café da manhã e brunch no Baixo Pinheiros, acaba de inaugurar um novo formato: o bar Daisy Nights.Sob o comando do bartender Chris Carijó, a carta de drinques traz 12 coquetéis.Continua após a publicidadeEsse balcão está curioso para experimentar o No Barbie Girl, inspirado nos tradicionais milkshakes dos EUA, feito com tequila, vermute e cobertura de xarope de framboesa.No Barbie Girl. Gustavo SteffenOutro que parece promissor é o Micky Jagermeister, com base de bourbon, jagermeister, chá mate e cold brew.A casa traz em sua decoração muitas referências dos anos 1970, um balcão em granilite cor de rosa e papel de parede com temática tropical.Micky Jaggermeister. Gustavo SteffenNa R. Padre Carvalho, 185 - Pinheiros.Campari Bartender CompetitionContinua após a publicidadeOsfinalistasda 3ª edição doCampariBartender Competition são Leonardo Santos (RJ), Lucas Gomez (SC) e Maxsuel Galvão (SE). Eles conquistaram uma vaga para a final e estão na disputa para ganhar uma viagem para Itália para conhecer a matriz e todo o universo deCamparie, possivelmente, se tornar embaixador da marca por um ano.World ClassJá nos preparativos para a edição global do World Class, que acontece este ano no Brasil, a Diageo acaba de anunciar o lançamento do documentário ""Spirit"", exclusivamente no Prime Video, que retrata o dia a dia dos finalistas da competição em 2022, que aconteceu em Sidney, na Austrália. O documentário revela os desafios de três dos melhores bartenders do mundo enquanto se preparam para criar os coquetéis mais importantes de suas carreiras.Aliás,O World Class Brasil já tem os seus 6 finalistas:Grace Kioko Sato - São Paulo/ KotoriJairo Gama - São Paulo/ vVstaMauro Melo - São Paulo/ PiccoRafael Câmara - Porto Alegre/ MesklaRodolfo Bob - São Paulo/ CaledôniaVitória Kurihara - Curitiba/ DuqA final acontece no próximo dia 5 de junho, no Pavilhão da Bienal.Continua após a publicidadeLançamentoO barAstore aAPTK (fundada com a assinatura de Alexandre D'Agostino, já premiado como o melhorbartenderde São Paulo) lançam  duas garrafas de vermute artesanal: oVermute Bianco e  o Vermute Rosso(R$ 140 cada um). As duas podem ser compradas no próprio Astor."
18,https://www.estadao.com.br/paladar/balcao-do-giba/a-coquetelaria-leve-e-redondinha-do-modern-momma-osteria/,"Olá,amigos.Todos bem?O Balcão de hoje visita um dos restaurantes italianos mais renomados de SP, o Modern Mamma Osteria.Claro, o motivo da nossa visita foi etílico, mais especificamente para tentar entender o sucesso que os coqueteis estão fazendo nas duas casas ( na de Pinheiros e no Itaim Bibi).newsletterPaladarAs melhores críticas gastronômicas, receitas e dicas de bares e restaurantes, às sextas-feiras.inscreverAo se cadastrar nas newsletters, você concorda com osTermos de UsoePolítica de Privacidade.Continua após a publicidadeBasílio Bianco. Foto Rodolfo ReginiFoto:  EstadãoSegundo a própria casa, logo após a pandemia, o restaurante teve um incremento de mais de 50% na venda de drinques - crescimento que, segundo oModern Mamma Osteria, teria sido puxado pelo consumo das mulheres.  Hoje, em média, são um pouco mais de 11 mil drinques mensais saindo da barra das unidades do Momma.Drinques leves e refrescantes. Foto Rodolfo ReginiFoto:  EstadãoO responsável pela coquetelaria dos restaurantes é Ricardo Barreiro.  Ele teve passagem pelo quase mítico MyNy (ao lado de Spencer Amereno Jr. e Kennedy Nascimento) e foi gerente de bebidas do Grand Hyatt. Em 2021, ficou entre os dez finalistas brasileiros no World Class.Continua após a publicidadeA carta aposta na refrescância e leveza - o que, provavelmente, tem sido um fator fundamental na conquista dos clientes.Ricardo Barreiro. Foto Rodolfo ReginiFoto:  EstadãoDestaque para o Basílico Bianco, um milk punch com  gim, limão siciliano e manjericão - basicamente um Basil Smash clarificado. Redondinho e aveludado. Certamente um coquetel vendedor.Na linha dos spritz, um dos maiores sucessos do restaurante, minha indicação é o Spring Spritz, com Ketel One Botanical grapefruit e rose, licor de cassis, limão e espumante.Para um clássico levemente modificado, tente o Julepino - com bourbon, pepino, limão e xarope de pêssego.Continua após a publicidadeOk, você é do meu time e quer finalizar com algo um pouco mais encorpado. Então, minha sugestão é correr os olhos até a carta de negronis e suas variações. A pedida aqui é o Coffee Negroni. Ele leva, gim, amaro, vermute rosso e uma saborosa espuma de café.Foto:  EstadãoModern Mamma OsteriaRua Manuel Guedes, 160 - Itaim Bibi.Rua Ferreira de Araújo, 342 - Pinheiros."
19,https://www.estadao.com.br/paladar/balcao-do-giba/conheca-as-prescricoes-do-dr-spencer-amereno-na-nova-carta-do-guilhotina-bar/,"Olá,amigosTodos bem?Sempre que o boato de uma carta nova assinada pelo bartender Spencer Amereno Jr. começa a ganhar corpo, uma ansiedade começa a fazer cócegas no povo da coquetelaria.Desta vez, o boato é real. No próximo dia 31 de janeiro, o Guilhotina Bar lança um novo menu de autoria do Spencer (um dos maiores bartenders do País - caso você ainda não saiba). Batizado de Antikamnia, a carta traz doze coquetéis autorais (um para cada mês do ano).Spencer Amereno Jr. Crédito: Rodolfo ReginiFoto:  EstadãonewsletterPaladarAs melhores críticas gastronômicas, receitas e dicas de bares e restaurantes, às sextas-feiras.inscreverAo se cadastrar nas newsletters, você concorda com osTermos de UsoePolítica de Privacidade.Aliás, o nome Antikamnia vem do analgésico criado em 1890, no Missouri, Estados Unidos. Na ocasião, a divulgação do medicamento era feita  pelo médico e artista Louis Crusius - que criou um calendário ilustrado com esqueletos.Continua após a publicidadeEntão, vamos descobrir um pouquinho do que o Dr. Amereno está nos receitando para a temporada que está prestes a começar...Coquetel da carta nova do Guilhorina. Crédito: Rodolfo ReginiFoto:  EstadãoO Balcão ainda não experimentou os novos drinques, mas já sabemos o que vem por aí. Entre os lançamentos está oCodeine(R$ 43) com Havana Club 3, Cambuci salgado e limão galego.Já o drinque que leva o nome da carta, oAntikamnia(R$ 47) é feito com o gin Jardim Botânico, Hidromel, limão tahiti, drambuie flambado com garnish de grade de mel.OSkulls(R$ 43) já me parece um pouco mais encorpado - e leva tequila blanco, tucupi, consomê de legumes, german lager e a Panc peixinho (frita e empanada).Coquetel da carta nova do Guilhorina. Crédito: Rodolfo ReginiFoto:  EstadãoOutros drinques que chamaram a atenção deste balcão, ao menos em teoria (pela relação de ingredientes) foram  oH3C(R$ 54,00), com Gentlemen Jack, rum Parnaioca, mel de romã, limão-siciliano e angostura Cocoa Bitters; e oMedicine(R$ 43,00), com Tequila Blanco com gordura de coco combinada com Tokaji dry, Campari e guarnição de sponge cake, um bolo aerado de carvão ativado.Continua após a publicidadeNa nova carta continuam aparecendo  outros onze clássicos já consagrados do Guilhotina, como o Verjus (R$ 43,00) e o Velho Nogueira (R$ 50,00), vermute tinto com nogueira, vermute seco, Ramazzotti Rosato e flor de mel.Coquetel da carta nova do Guilhorina. Crédito: Rodolfo ReginiFoto:  EstadãoNotíciasHowler HeadEstá chegando ao Brasil o Howler Head, uísque premium original com aroma natural de banana. O produto foi adquirido pelo Grupo Campari, com uma participação inicial de 15%. Ele já está sendo vendido no Rio de Janeiro. Em fevereiro, ele chega a outros pontos do País.Bar de ProseccoConhecida por ser uma das marcas de prosecco mais vendidas no mundo, a Mionetto, pertencente ao portfólio de bebidas da Henkell Freixenet, acaba de inaugurar um bar especial, dentro do complexo gastronômico do Eataly, em São Paulo.Continua após a publicidadeCocktail ClubeA APTK Spirits,empresa de coquetéis engarrafadosque tem como sócio o premiadíssimo bartenderAle D’Agostino,lança o “Cocktail Clube” -um clube  de assinatura de coquetéis.  OCocktail Clubeé focado exclusivamente no e-commerce e disponibiliza três possibilidades de planos. No Bronze (R$ 119,99 por mês), o cliente recebe mensalmente um drinque engarrafado de 375ml mais um voucher de desconto nas lojas, uma ficha técnica com detalhes sobre a bebida e um brinde exclusivo. No Prata (R$ 219,99 por mês) vão dois drinques e no Ouro (R$ 329,99 por mês) são três garrafas e ainda um acessório surpresa."
20,https://www.estadao.com.br/paladar/balcao-do-giba/conheca-a-coquetelaria-de-espirito-latino-do-jabali-novo-bar-na-santa-cecilia/,"Olá, amigos.Todos bem?Como já cantou Belchior, ""eu sou apenas um rapaz latino americano...""E como rapaz latino americano fui visitar o Jabalí, bar/restaurante recém-aberto na Santa Cecília.newsletterPaladarAs melhores críticas gastronômicas, receitas e dicas de bares e restaurantes, às sextas-feiras.inscreverAo se cadastrar nas newsletters, você concorda com osTermos de UsoePolítica de Privacidade.Criada pelo chef  Rodrigo Valente, a casa tem inspiração na cultura sul-americana. Essa ""pegada"", claro, se reflete na gastronomia e, com resultado surpreendente, na coquetelaria.Continua após a publicidadeEntrada do Jabali. Crédito Victor CollorNo caso do Jabalí, a carta de drinques ficou por conta do premiado mixologista Marco de La Roche.A latinidade da coquetelaria do Marco está na utilização de ingredientes como a tiquira, o pisco, rum, cachaça e outros.Meu preferido dessa leva foi o Quetzal. Uma espécie de martini macio e redondinho - com utilização de tiquira, hidromel, cajuína e çapó de guaraná (espécie de chá feito do guaraná).Continua após a publicidadeTambém é muito interessante um drinque tiki com pisco, o Muiraquitâ - que vai em um copo diferentão e leva o já citado pisco, licor de tamarindo, cupuaçu, maracujá e bitter.Para encerrar a noite, a pedida é o  Pan y Trabajo. Além do ótimo nome, o coquetel atende aos anseios de quem procura algo com um punch alcoólico mais alto e aos fãs de clássicos como negroni e boulevardier. Aqui vai com rum envelhecido, vinho quinado e licor de café.Uma ótima saideira.Pan y Trabajo. Crédito Victor CollorContinua após a publicidadeAh, provavelmente por uma homenagem aos nossos hermanos argentinos, a carta também traz um Fernet Cola (um sucesso histórico no país vizinho).Em São Paulo, novos bares nascem todos os dias. Nem todos sobrevivem ao competitivo mercado. Minha aposta: Jabalí tem vida longa. Muito longa.O Jabalí fica na R. Martim Francisco, 655.Continua após a publicidadeAlerta de cartas novas:CAFÉ HOTELEra um buraco no meu currículo. Eu nunca tinha ido no Café Hotel. Sempre vi muitas fotos, me impressionava com o clima de festa e sentia que a casa era o lugar ideal para o meu Tinder enlouquecer; Mas nunca pensei em beber por lá.Felizmente, tive a oportunidade de visitar o Café Hotel na semana passada. A nova carta de coquetéis foicriada pelas mãos dos bartenders residentes Renan Militão e Felipe Santana. Por lá, encontrei drinques surpreendentes, como o Deluxe ( uísque Gold Label, Tio Pepe, cordial de camomila, tintura de coentro e spray de absinto) e o Ball Room (que leva tequila infusionada com casca de beterraba, Tio Pepe, tintura de coentro e Angostura de laranja). Claro, existem drinques mais refrescantes e com jeitão de balada. Todos bem feitos.R. Amaro Cavalheiro, 22 - Pinheiros.Coquetel do Café Hotel. Crédito Rodolfo ReginiContinua após a publicidadeTRINCA BAR & VERMUTERIAPrestes a completar um ano de vida, o Trinca já se transformou em um dos bares preferidos deste balcão. A nova carta é assinada por Alê Bussab e Tábata Magarão. Ainda não experimentei a nova leva, mas estou interessadíssimo no Dirty Clubland (preparado com bitter de absinto, angostura, vodca, Porto branco e água de picles de uva); no Gim Bamboo (resultado da mistura de jerez fino, gim, vermute Dolin Dry, licor Luxardo Maraschino, fat wash de manteiga de cacau e azeite de uva) e no Pass Coffee Hanky Panky ( que leva vermute rosé da casa, gim YVY terra, fernet branca e infusão de uva passa e café). Na Rua Costa Carvalho, 96 - Pinheiros.Coquetel do Trinca. Crédito Tales Hidequi"
